<?xml version="1.0" encoding="UTF-8"?>
<root
	xmlns="http://xml.safris.org/schema/binding/test/unit/mixed.xsd"
	xmlns:xsi="http://www.w3.org/2001/XMLSchema-instance"
	xsi:schemaLocation="http://xml.safris.org/schema/binding/test/unit/mixed.xsd mixed.xsd">
	<zero/>
	<oneEx>mixed</oneEx>
	<oneRe/>
	<two>mixed</two>
	<three>mixed</three>
	<four>mixed</four>
	<five/>
	<six>mixed</six>
	<seven/>
	<eight>mixed</eight>
	<ten/>
	<elevenEx>mixed</elevenEx>
	<elevenRe/>
	<twelve>mixed</twelve>
	<thirteen>mixed</thirteen>
	<fourteen>mixed</fourteen>
	<fifteen/>
	<sixteen>mixed</sixteen>
	<seventeen/>
	<eighteen>mixed</eighteen>
	<twenty/>
	<twentyOne/>
	<twentyTwo>mixed</twentyTwo>
	<twentyThree>mixed</twentyThree>
	<twentyFour>mixed</twentyFour>
	<twentyFive/>
	<twentySix>mixed</twentySix>
	<twentySeven/>
	<twentyEight>mixed</twentyEight>
	<thirty>mixed</thirty>
	<thirtyOne>mixed</thirtyOne>
	<thirtyTwo>mixed</thirtyTwo>
	<thirtyThree>mixed</thirtyThree>
	<thirtyFour>mixed</thirtyFour>
	<thirtyFive>mixed</thirtyFive>
	<thirtySix>mixed</thirtySix>
	<thirtySeven/>
	<thirtyEight>mixed</thirtyEight>
</root>
